{
  "schema_version": 1,
  "id": "stage-fixture",
  "kind": "stage",
  "identity": {
    "runtime_user": "deploy-stage",
    "runtime_group": "deploy-stage",
    "ci_user": "stage-ci",
    "ci_group": "stage-ci"
  },
  "git": {
    "remote": "origin",
    "branch": "stage"
  },
  "github": {
    "reporting_helper": "/usr/local/lib/apitoken-stage-watchdog/watchdog-github",
    "config_file": "/etc/apitoken-staging/github-watchdog.env",
    "status_contexts": {
      "watchdog": "stage/watchdog",
      "watchdog_log": "stage/watchdog-log",
      "tests": "stage/tests",
      "migration": "stage/migration",
      "engine": "stage/engine",
      "backend": "stage/backend",
      "sales": "stage/sales",
      "openkeys": "stage/openkeys",
      "admin": "stage/admin",
      "devbot": "stage/devbot",
      "gpt_image_public_preflight": "stage/gpt-image-2-public-preflight",
      "gpt_image_public_preflight_v2": "stage/gpt-image-2-public-preflight-v2",
      "gpt_image_public_preflight_v3": "stage/gpt-image-2-public-preflight-v3",
      "gpt_image_public_generation": "stage/gpt-image-2-public-generation",
      "gpt_image_public_edit": "stage/gpt-image-2-public-edit",
      "gpt_image_public_paid_inspect": "stage/gpt-image-2-public-paid-inspect",
      "gpt_image_probe_medium": "stage/gpt-image-2-probe-medium",
      "gpt_image_probe_high": "stage/gpt-image-2-probe-high",
      "gpt_image_probe_multi_ref": "stage/gpt-image-2-probe-multi-ref"
    },
    "deployment_environments": {
      "candidate_validation": "staging-candidate-validation",
      "database": "staging-database",
      "engine": "staging-engine",
      "backend": "staging-backend",
      "sales": "staging-sales",
      "openkeys": "staging-openkeys",
      "admin": "staging-admin",
      "devbot": "staging-devbot"
    }
  },
  "roots": {
    "source_repo": "/opt/apitoken-staging/repo",
    "state": "/var/lib/apitoken-staging/watchdog",
    "candidate": "/var/lib/apitoken-staging/watchdog/candidates",
    "ci_home": "/var/lib/apitoken-staging/watchdog/ci-home",
    "ci_cargo_target": "/var/lib/apitoken-staging/watchdog/ci-home/cargo-target",
    "ci_next_cache": "/var/lib/apitoken-staging/watchdog/ci-home/next-cache",
    "ci_typescript_artifact_cache": "/var/lib/apitoken-staging/watchdog/ci-home/typescript-artifacts",
    "ci_toolchain": "/opt/apitoken-stage-watchdog/rust-toolchain",
    "controller": "/usr/local/lib/apitoken-stage-watchdog/controller",
    "engine_release": "/srv/claude-api-staging/releases",
    "commerce_release": "/opt/apitoken-staging/releases",
    "sales_release": "/opt/apitoken-staging/sales-releases",
    "openkeys_release": "/opt/apitoken-staging/openkeys-releases",
    "admin_release": "/opt/apitoken-staging/admin-releases",
    "devbot_release": "/opt/apitoken-staging/devbot-releases",
    "crm_release": "/opt/apitoken-staging/crm-releases",
    "backup": "/var/lib/apitoken-staging/backups",
    "spool": "/var/lib/apitoken-staging/spool",
    "anthropic_runtime_prefix": "/run/claude-api-stage-anthropic",
    "data": "/srv/claude-api-staging/data",
    "config": "/etc/apitoken-staging",
    "caddy_config": "/etc/apitoken-staging/caddy/Caddyfile",
    "router_active": "/etc/apitoken-staging/caddy/router-active.caddy",
    "systemd_units": "/etc/apitoken-staging/systemd",
    "cache": "/var/lib/apitoken-staging"
  },
  "locks": {
    "watchdog": "/run/lock/apitoken-stage-watchdog.lock",
    "candidate_validator": "/run/lock/apitoken-stage-candidate-validator.lock",
    "source_fetch": "/run/lock/apitoken-stage-source-fetch.lock",
    "deploy": "/run/lock/apitoken-stage-deploy.lock",
    "migration": "/run/lock/apitoken-stage-db-migrate.lock"
  },
  "ports": {
    "postgres": 5433,
    "redis_history": 6379,
    "redis_affinity": 6380,
    "test_postgres_base": 15432,
    "test_redis_base": 16379,
    "anthropic_slots": [
      8787,
      8788
    ],
    "anthropic_stable": 8790,
    "commerce_slots": [
      3000,
      3001
    ],
    "commerce_stable": 8791,
    "openai_slots": [
      8793,
      8797
    ],
    "openai_stable": 8792,
    "gemini_slots": [
      8795,
      8799
    ],
    "gemini_stable": 8794,
    "router_legacy": 8798,
    "router_slots": [
      8800,
      8801
    ],
    "router_stable": 8802,
    "kimi_slots": [
      8804,
      8805
    ],
    "kimi_stable": 8803,
    "sales_api": 3100,
    "sales_web": 3200,
    "openkeys": 3410,
    "content_studio": 3500,
    "grafana": 3600,
    "admin": 3700,
    "devbot": 3800,
    "prometheus": 9090
  },
  "origins": {
    "anthropic_stable": "http://127.0.0.1:8790",
    "commerce_stable": "http://127.0.0.1:8791",
    "openai_stable": "http://127.0.0.1:8792",
    "gemini_stable": "http://127.0.0.1:8794",
    "router_stable": "http://127.0.0.1:8802",
    "kimi_stable": "http://127.0.0.1:8803",
    "sales_api": "http://127.0.0.1:3100",
    "sales_web": "http://127.0.0.1:3200",
    "openkeys": "http://127.0.0.1:3410",
    "content_studio": "http://127.0.0.1:3500",
    "grafana": "http://127.0.0.1:3600",
    "admin": "http://127.0.0.1:3700",
    "devbot": "http://127.0.0.1:3800",
    "prometheus": "http://127.0.0.1:9090",
    "public_engine": "https://api.staging.invalid",
    "public_backend": "https://backend.staging.invalid",
    "public_sales": "https://partners.staging.invalid",
    "public_openkeys": "https://openkeys.staging.invalid",
    "public_admin": "https://admin.staging.invalid",
    "public_admin_partners": "https://admin.partners.staging.invalid",
    "public_crm": "https://crm.staging.invalid",
    "public_content_studio": "https://content-studio.staging.invalid",
    "public_monitoring": "https://monitoring.staging.invalid",
    "public_openai": "https://openai.api.staging.invalid",
    "public_gemini": "https://gemini.api.staging.invalid",
    "github_web": "https://github.staging.invalid",
    "retired_panel": "https://panel.staging.invalid",
    "retired_partners_panel": "https://partners.panel.staging.invalid",
    "retired_crm_panel": "https://crm.panel.staging.invalid"
  },
  "compose_projects": {
    "postgres": "stage-deploy",
    "redis": "stage-apitoken-affinity",
    "test_postgres_prefix": "stage-apitoken-watchdog-postgres",
    "test_redis_prefix": "stage-apitoken-watchdog-redis"
  },
  "units": {
    "watchdog_service": "apitoken-deploy-watchdog-stage.service",
    "watchdog_timer": "apitoken-deploy-watchdog-stage.timer",
    "candidate_validator_service": "apitoken-candidate-validator-stage.service",
    "candidate_validator_timer": "apitoken-candidate-validator-stage.timer",
    "backup_service": "claude-api-backup-stage.service",
    "engine_legacy": "claude-api-stage.service",
    "engine_bridge_template": "claude-api@-stage.service",
    "anthropic_template": "claude-api-anthropic@-stage.service",
    "openai_legacy": "claude-api-openai-stage.service",
    "openai_template": "claude-api-openai@-stage.service",
    "gemini_legacy": "claude-api-gemini-stage.service",
    "gemini_template": "claude-api-gemini@-stage.service",
    "kimi_legacy": "claude-api-kimi-stage.service",
    "kimi_template": "claude-api-kimi@-stage.service",
    "router_legacy": "claude-router-stage.service",
    "router_template": "claude-router@-stage.service",
    "commerce_template": "apitoken-api@-stage.service",
    "worker": "apitoken-worker-stage.service",
    "content_studio": "apitoken-content-studio-stage.service",
    "sales_api": "apitoken-sales-api-stage.service",
    "sales_web": "apitoken-sales-web-stage.service",
    "openkeys": "apitoken-openkeys-stage.service",
    "admin": "apitoken-admin-stage.service",
    "devbot": "apitoken-devbot-stage.service",
    "postgres": "apitoken-postgres-stage.service",
    "redis": "apitoken-affinity-redis-stage.service",
    "authbot": "claude-authbot-stage.service",
    "anthropic_slice": "claude-api-anthropic-stage.slice",
    "openai_slice": "claude-api-openai-stage.slice",
    "gemini_slice": "claude-api-gemini-stage.slice",
    "router_slice": "claude-router-stage.slice",
    "crm_api": "apitoken-crm-api-stage.service",
    "crm_web": "apitoken-crm-web-stage.service"
  },
  "lanes": {
    "typescript": true,
    "rust": true,
    "static": true,
    "infrastructure": true,
    "engine": true,
    "backend": true,
    "sales": true,
    "openkeys": true,
    "admin": true,
    "devbot": true,
    "candidate_validation": true,
    "production_apply": false,
    "staging_admission": false
  },
  "network": {
    "namespace": "apitoken-stage",
    "loopback_host": "127.0.0.1",
    "public_inbound": false
  },
  "resources": {
    "slice": "staging.slice",
    "rootless_docker": true
  }
}
