{
  "schema_version": 1,
  "id": "production",
  "kind": "production",
  "identity": {
    "runtime_user": "deploy",
    "runtime_group": "deploy",
    "ci_user": "apitoken-ci",
    "ci_group": "apitoken-ci"
  },
  "git": {
    "remote": "origin",
    "branch": "$(touch /tmp/contour-owned-code-ran)"
  },
  "github": {
    "reporting_helper": "/usr/local/lib/apitoken-watchdog/watchdog-github",
    "config_file": "/etc/apitoken/github-watchdog.env",
    "status_contexts": {
      "watchdog": "deploy/watchdog",
      "watchdog_log": "deploy/watchdog-log",
      "tests": "deploy/tests",
      "migration": "deploy/migration",
      "engine": "deploy/engine",
      "backend": "deploy/backend",
      "sales": "deploy/sales",
      "openkeys": "deploy/openkeys",
      "admin": "deploy/admin",
      "devbot": "deploy/devbot",
      "gpt_image_public_preflight": "deploy/gpt-image-2-public-preflight",
      "gpt_image_public_preflight_v2": "deploy/gpt-image-2-public-preflight-v2",
      "gpt_image_public_preflight_v3": "deploy/gpt-image-2-public-preflight-v3",
      "gpt_image_public_generation": "deploy/gpt-image-2-public-generation",
      "gpt_image_public_edit": "deploy/gpt-image-2-public-edit",
      "gpt_image_public_paid_inspect": "deploy/gpt-image-2-public-paid-inspect",
      "gpt_image_probe_medium": "deploy/gpt-image-2-probe-medium",
      "gpt_image_probe_high": "deploy/gpt-image-2-probe-high",
      "gpt_image_probe_multi_ref": "deploy/gpt-image-2-probe-multi-ref"
    },
    "deployment_environments": {
      "candidate_validation": "candidate-validation",
      "database": "production-database",
      "engine": "production-engine",
      "backend": "production-backend",
      "sales": "production-sales",
      "openkeys": "production-openkeys",
      "admin": "production-admin",
      "devbot": "production-devbot"
    }
  },
  "roots": {
    "source_repo": "/opt/apitoken/repo",
    "state": "/var/lib/apitoken/watchdog",
    "candidate": "/var/lib/apitoken/watchdog/candidates",
    "ci_home": "/var/lib/apitoken/watchdog/ci-home",
    "ci_cargo_target": "/var/lib/apitoken/watchdog/ci-home/cargo-target",
    "ci_next_cache": "/var/lib/apitoken/watchdog/ci-home/next-cache",
    "ci_typescript_artifact_cache": "/var/lib/apitoken/watchdog/ci-home/typescript-artifacts",
    "ci_toolchain": "/opt/apitoken-watchdog/rust-toolchain",
    "controller": "/usr/local/lib/apitoken-watchdog/controller",
    "engine_release": "/srv/claude-api/releases",
    "commerce_release": "/opt/apitoken/releases",
    "sales_release": "/opt/apitoken/sales-releases",
    "openkeys_release": "/opt/apitoken/openkeys-releases",
    "admin_release": "/opt/apitoken/admin-releases",
    "devbot_release": "/opt/apitoken/devbot-releases",
    "crm_release": "/opt/apitoken/crm-releases",
    "backup": "/var/lib/apitoken/backups",
    "spool": "/var/lib/apitoken/spool",
    "anthropic_runtime_prefix": "/run/claude-api-anthropic",
    "data": "/srv/claude-api/data",
    "config": "/etc/apitoken",
    "caddy_config": "/etc/caddy/Caddyfile",
    "router_active": "/etc/caddy/router-active.caddy",
    "systemd_units": "/etc/systemd/system",
    "cache": "/var/lib/apitoken"
  },
  "locks": {
    "watchdog": "/run/lock/apitoken-watchdog.lock",
    "candidate_validator": "/run/lock/apitoken-candidate-validator.lock",
    "source_fetch": "/run/lock/apitoken-source-fetch.lock",
    "deploy": "/run/lock/apitoken-deploy.lock",
    "migration": "/run/lock/apitoken-db-migrate.lock"
  },
  "ports": {
    "postgres": 5433,
    "redis_history": 6379,
    "redis_affinity": 6380,
    "test_postgres_base": 15432,
    "test_redis_base": 16379,
    "anthropic_slots": [
      8787,
      8788
    ],
    "anthropic_stable": 8790,
    "commerce_slots": [
      3000,
      3001
    ],
    "commerce_stable": 8791,
    "openai_slots": [
      8793,
      8797
    ],
    "openai_stable": 8792,
    "gemini_slots": [
      8795,
      8799
    ],
    "gemini_stable": 8794,
    "router_legacy": 8798,
    "router_slots": [
      8800,
      8801
    ],
    "router_stable": 8802,
    "kimi_slots": [
      8804,
      8805
    ],
    "kimi_stable": 8803,
    "sales_api": 3100,
    "sales_web": 3200,
    "openkeys": 3410,
    "content_studio": 3500,
    "grafana": 3600,
    "admin": 3700,
    "devbot": 3800,
    "prometheus": 9090
  },
  "origins": {
    "anthropic_stable": "http://127.0.0.1:8790",
    "commerce_stable": "http://127.0.0.1:8791",
    "openai_stable": "http://127.0.0.1:8792",
    "gemini_stable": "http://127.0.0.1:8794",
    "router_stable": "http://127.0.0.1:8802",
    "kimi_stable": "http://127.0.0.1:8803",
    "sales_api": "http://127.0.0.1:3100",
    "sales_web": "http://127.0.0.1:3200",
    "openkeys": "http://127.0.0.1:3410",
    "content_studio": "http://127.0.0.1:3500",
    "grafana": "http://127.0.0.1:3600",
    "admin": "http://127.0.0.1:3700",
    "devbot": "http://127.0.0.1:3800",
    "prometheus": "http://127.0.0.1:9090",
    "public_engine": "https://api.apitoken.sale",
    "public_backend": "https://backend.apitoken.sale",
    "public_sales": "https://partners.apitoken.sale",
    "public_openkeys": "https://openkeys.apitoken.sale",
    "public_admin": "https://admin.apitoken.sale",
    "public_admin_partners": "https://admin.partners.apitoken.sale",
    "public_crm": "https://crm.apitoken.sale",
    "public_content_studio": "https://content-studio.apitoken.sale",
    "public_monitoring": "https://monitoring.apitoken.sale",
    "public_openai": "https://openai.api.apitoken.sale",
    "public_gemini": "https://gemini.api.apitoken.sale",
    "github_web": "https://github.com",
    "retired_panel": "https://panel.apitoken.sale",
    "retired_partners_panel": "https://partners.panel.apitoken.sale",
    "retired_crm_panel": "https://crm.panel.apitoken.sale"
  },
  "compose_projects": {
    "postgres": "deploy",
    "redis": "apitoken-affinity",
    "test_postgres_prefix": "apitoken-watchdog-postgres",
    "test_redis_prefix": "apitoken-watchdog-redis"
  },
  "units": {
    "watchdog_service": "apitoken-deploy-watchdog.service",
    "watchdog_timer": "apitoken-deploy-watchdog.timer",
    "candidate_validator_service": "apitoken-candidate-validator.service",
    "candidate_validator_timer": "apitoken-candidate-validator.timer",
    "backup_service": "claude-api-backup.service",
    "engine_legacy": "claude-api.service",
    "engine_bridge_template": "claude-api@.service",
    "anthropic_template": "claude-api-anthropic@.service",
    "openai_legacy": "claude-api-openai.service",
    "openai_template": "claude-api-openai@.service",
    "gemini_legacy": "claude-api-gemini.service",
    "gemini_template": "claude-api-gemini@.service",
    "kimi_legacy": "claude-api-kimi.service",
    "kimi_template": "claude-api-kimi@.service",
    "router_legacy": "claude-router.service",
    "router_template": "claude-router@.service",
    "commerce_template": "apitoken-api@.service",
    "worker": "apitoken-worker.service",
    "content_studio": "apitoken-content-studio.service",
    "sales_api": "apitoken-sales-api.service",
    "sales_web": "apitoken-sales-web.service",
    "openkeys": "apitoken-openkeys.service",
    "admin": "apitoken-admin.service",
    "devbot": "apitoken-devbot.service",
    "postgres": "apitoken-postgres.service",
    "redis": "apitoken-affinity-redis.service",
    "authbot": "claude-authbot.service",
    "anthropic_slice": "claude-api-anthropic.slice",
    "openai_slice": "claude-api-openai.slice",
    "gemini_slice": "claude-api-gemini.slice",
    "router_slice": "claude-router.slice",
    "crm_api": "apitoken-crm-api.service",
    "crm_web": "apitoken-crm-web.service"
  },
  "lanes": {
    "typescript": true,
    "rust": true,
    "static": true,
    "infrastructure": true,
    "engine": true,
    "backend": true,
    "sales": true,
    "openkeys": true,
    "admin": true,
    "devbot": true,
    "candidate_validation": true,
    "production_apply": true,
    "staging_admission": false
  },
  "network": {
    "namespace": "host",
    "loopback_host": "127.0.0.1",
    "public_inbound": true
  },
  "resources": {
    "slice": "system.slice",
    "rootless_docker": false
  }
}
